{
  "schema_version": "v0",
  "face_id": "1da86dd7b40f080e8b10a742b6669b7eb80a91274e2190301157f7aa7fca4f80",
  "media_id": "4086a6f2bc6cc368bbcdf98be7ce7cf39b8b1ddb5ebd3e26d91e86fb56bba93c",
  "frame_time": null,
  "track": null,
  "detection": {
    "bbox": { "x": 0.6188, "y": 0.2417, "w": 0.0475, "h": 0.0708, "rotation_deg": 0 },
    "detection_score": 0.8134,
    "detector": {
      "model_id": "scrfd-10g-bnkps",
      "version": "1.0.0",
      "weights_blake3": "c450fc2acdb89952121a46dc9afb23f0bbfe2d875be8accaf1edb2eb69749330",
      "runtime": "onnxruntime_coreml",
      "precision": "fp16"
    },
    "detected_on": "thumbnail_512",
    "face_area_ratio": 0.0034
  },
  "landmarks": {
    "scheme": "insightface_5",
    "points": [
      { "x": 0.6301, "y": 0.2612 },
      { "x": 0.6522, "y": 0.2598 },
      { "x": 0.6407, "y": 0.2731 },
      { "x": 0.6318, "y": 0.2856 },
      { "x": 0.6504, "y": 0.2849 }
    ],
    "score": 0.611
  },
  "embedding": {
    "space": "arcface_buffalo_l_512",
    "dimensions": 512,
    "storage": "index",
    "index_key": "vec:face:1da86dd7:arcface_buffalo_l_512",
    "values": null,
    "quantization": "float32",
    "normalized": true
  },
  "attributes": {
    "yaw_deg": -47.8,
    "pitch_deg": 11.4,
    "roll_deg": 6.2,
    "eyes_open": 0.542,
    "smile": 0.318,
    "mouth_open": 0.101,
    "gaze_on_camera": 0.211,
    "sharpness": 0.34,
    "occlusion": 0.28,
    "wearing_sunglasses": 0.02,
    "wearing_mask": 0.0,
    "quality": { "value": 0.29, "run_id": "run-facequality-0304" }
  },
  "cluster": {
    "cluster_id": "d41f8b62-0c3a-4e57-9b18-7a25e6c4f930",
    "method": "hdbscan_cosine",
    "membership_strength": 0.412,
    "is_noise": false,
    "distance_to_centroid": 0.617,
    "clustering_run_id": "cluster-run-0042"
  },
  "identity": {
    "person_id": null,
    "assignment": "auto_below_threshold",
    "confidence": 0.7418,
    "threshold_profile": "automated_output",
    "threshold_used": 0.92,
    "eligible_for_automated_output": false,
    "candidates": [
      { "person_id": "3f2a91c4-7b6e-4d1a-9c85-2e4b7a1f6d03", "confidence": 0.7418 },
      { "person_id": "b8e5c710-2d94-4f36-8a71-6c03d9e2b4a5", "confidence": 0.6902 }
    ],
    "review_reason": "below_threshold",
    "decided_by": "model",
    "decided_at": "2026-03-14T10:02:44+05:30"
  },
  "sensitive": {
    "minor_status": "unknown",
    "labeling_consent": null,
    "excluded_from_sharing": false
  },
  "model_runs": [],
  "created_at": "2026-03-14T10:02:44+05:30",
  "updated_at": "2026-03-14T10:02:44+05:30"
}
